{
  "schema_version": 1,
  "width": 80,
  "height": 8,
  "pixels": [
    [
      0,
      0,
      0,
      0,
      0,
      0,
      0,
      0,
      0,
      0,
      0,
      0,
      0,
      0,
      0,
      0,
      0,
      0,
      0,
      0,
      0,
      0,
      0,
      0,
      0,
      0,
      0,
      0,
      0,
      0,
      0,
      0,
      0,
      0,
      0,
      0,
      0,
      0,
      0,
      0,
      0,
      0,
      0,
      0,
      0,
      0,
      0,
      0,
      0,
      0,
      0,
      0,
      0,
      0,
      0,
      0,
      0,
      0,
      0,
      0,
      0,
      0,
      0,
      0,
      0,
      0,
      3,
      3,
      3,
      3,
      0,
      0,
      0,
      0,
      0,
      0,
      0,
      0,
      0,
      0
    ],
    [
      0,
      0,
      3,
      0,
      0,
      0,
      0,
      0,
      0,
      0,
      0,
      3,
      0,
      0,
      0,
      0,
      0,
      0,
      0,
      0,
      3,
      0,
      0,
      0,
      0,
      0,
      0,
      3,
      0,
      0,
      0,
      0,
      0,
      0,
      3,
      3,
      3,
      0,
      0,
      0,
      0,
      0,
      3,
      3,
      3,
      0,
      0,
      0,
      0,
      0,
      0,
      0,
      0,
      0,
      0,
      0,
      0,
      0,
      3,
      3,
      3,
      3,
      0,
      0,
      0,
      3,
      0,
      0,
      0,
      0,
      3,
      0,
      0,
      0,
      0,
      0,
      0,
      0,
      0,
      0
    ],
    [
      0,
      0,
      3,
      3,
      0,
      0,
      0,
      0,
      0,
      0,
      0,
      3,
      3,
      0,
      0,
      0,
      0,
      0,
      0,
      0,
      3,
      3,
      0,
      0,
      0,
      3,
      0,
      3,
      3,
      0,
      0,
      0,
      0,
      0,
      3,
      0,
      0,
      0,
      0,
      0,
      0,
      0,
      0,
      0,
      3,
      0,
      0,
      0,
      0,
      0,
      0,
      3,
      3,
      0,
      0,
      0,
      0,
      3,
      3,
      3,
      3,
      3,
      3,
      0,
      3,
      0,
      0,
      3,
      3,
      0,
      0,
      3,
      0,
      0,
      0,
      0,
      0,
      0,
      0,
      0
    ],
    [
      0,
      0,
      3,
      3,
      3,
      0,
      0,
      0,
      0,
      0,
      0,
      3,
      3,
      3,
      0,
      0,
      0,
      0,
      0,
      0,
      3,
      3,
      3,
      0,
      0,
      3,
      0,
      3,
      3,
      3,
      0,
      0,
      0,
      0,
      3,
      0,
      0,
      0,
      0,
      0,
      0,
      0,
      0,
      0,
      3,
      0,
      0,
      0,
      0,
      0,
      0,
      3,
      3,
      0,
      0,
      0,
      0,
      3,
      3,
      3,
      3,
      3,
      3,
      0,
      3,
      0,
      0,
      3,
      3,
      0,
      0,
      3,
      3,
      3,
      3,
      3,
      3,
      3,
      3,
      3
    ],
    [
      0,
      0,
      3,
      3,
      3,
      0,
      0,
      0,
      0,
      0,
      0,
      3,
      3,
      3,
      0,
      0,
      0,
      0,
      0,
      0,
      3,
      3,
      3,
      0,
      0,
      3,
      0,
      3,
      3,
      3,
      0,
      0,
      0,
      0,
      3,
      0,
      0,
      0,
      0,
      0,
      0,
      0,
      0,
      0,
      3,
      0,
      0,
      0,
      0,
      0,
      0,
      0,
      0,
      0,
      0,
      0,
      0,
      0,
      3,
      3,
      3,
      3,
      0,
      0,
      3,
      0,
      0,
      0,
      0,
      0,
      0,
      3,
      0,
      0,
      0,
      0,
      0,
      0,
      0,
      0
    ],
    [
      0,
      0,
      3,
      3,
      0,
      0,
      0,
      0,
      0,
      0,
      0,
      3,
      3,
      0,
      0,
      0,
      0,
      0,
      0,
      0,
      3,
      3,
      0,
      0,
      0,
      3,
      0,
      3,
      3,
      0,
      0,
      0,
      0,
      0,
      3,
      0,
      0,
      0,
      0,
      0,
      0,
      0,
      0,
      0,
      3,
      0,
      0,
      0,
      0,
      0,
      0,
      0,
      0,
      0,
      0,
      0,
      0,
      0,
      0,
      0,
      0,
      0,
      0,
      0,
      0,
      3,
      0,
      0,
      0,
      0,
      3,
      0,
      0,
      0,
      0,
      0,
      0,
      0,
      0,
      0
    ],
    [
      0,
      0,
      3,
      0,
      0,
      0,
      0,
      0,
      0,
      0,
      0,
      3,
      0,
      0,
      0,
      0,
      0,
      0,
      0,
      0,
      3,
      0,
      0,
      0,
      0,
      0,
      0,
      3,
      0,
      0,
      0,
      0,
      0,
      0,
      3,
      3,
      3,
      0,
      0,
      0,
      0,
      0,
      3,
      3,
      3,
      0,
      0,
      0,
      0,
      0,
      0,
      0,
      0,
      0,
      0,
      0,
      0,
      0,
      0,
      0,
      0,
      0,
      0,
      0,
      0,
      0,
      3,
      3,
      3,
      3,
      0,
      0,
      0,
      0,
      0,
      0,
      0,
      0,
      0,
      0
    ],
    [
      0,
      0,
      0,
      0,
      0,
      0,
      0,
      0,
      0,
      0,
      0,
      0,
      0,
      0,
      0,
      0,
      0,
      0,
      0,
      0,
      0,
      0,
      0,
      0,
      0,
      0,
      0,
      0,
      0,
      0,
      0,
      0,
      0,
      0,
      0,
      0,
      0,
      0,
      0,
      0,
      0,
      0,
      0,
      0,
      0,
      0,
      0,
      0,
      0,
      0,
      0,
      0,
      0,
      0,
      0,
      0,
      0,
      0,
      0,
      0,
      0,
      0,
      0,
      0,
      0,
      0,
      0,
      0,
      0,
      0,
      0,
      0,
      0,
      0,
      0,
      0,
      0,
      0,
      0,
      0
    ]
  ]
}
